{
  "schemaVersion": 1,
  "kind": "api_migrator_linux_l7_runtime_manifest",
  "runtimeRootPath": "/usr/local/libexec/api-migrator",
  "closurePolicy": "exact_root_sealed_transitive_closure",
  "artifacts": [
    {
      "role": "lifecycle_orchestrator",
      "path": "/usr/local/libexec/api-migrator/deployment/run-gateway-lifecycle.mjs",
      "digest": "sha256:eeeeeeeeeeeeeeeeeeeeeeeeeeeeeeeeeeeeeeeeeeeeeeeeeeeeeeeeeeeeeeee"
    },
    {
      "role": "lifecycle_observer",
      "path": "/usr/local/libexec/api-migrator/deployment/observe-gateway-lifecycle.mjs",
      "digest": "sha256:ffffffffffffffffffffffffffffffffffffffffffffffffffffffffffffffff"
    },
    {
      "role": "lifecycle_preflight",
      "path": "/usr/local/libexec/api-migrator/deployment/lifecycle-preflight.mjs",
      "digest": "sha256:1010101010101010101010101010101010101010101010101010101010101010"
    },
    {
      "role": "runtime_manifest_module",
      "path": "/usr/local/libexec/api-migrator/deployment/runtime-manifest.mjs",
      "digest": "sha256:1111111111111111111111111111111111111111111111111111111111111112"
    },
    {
      "role": "lifecycle_drill",
      "path": "/usr/local/libexec/api-migrator/deployment/lifecycle-drill.mjs",
      "digest": "sha256:1212121212121212121212121212121212121212121212121212121212121212"
    },
    {
      "role": "deployment_lib",
      "path": "/usr/local/libexec/api-migrator/deployment/lib.mjs",
      "digest": "sha256:1313131313131313131313131313131313131313131313131313131313131313"
    },
    {
      "role": "gateway_probe",
      "path": "/usr/local/libexec/api-migrator/gateway/gateway-probe.mjs",
      "digest": "sha256:abababababababababababababababababababababababababababababababab"
    },
    {
      "role": "gateway_contract",
      "path": "/usr/local/libexec/api-migrator/gateway/gateway-contract.mjs",
      "digest": "sha256:1414141414141414141414141414141414141414141414141414141414141414"
    },
    {
      "role": "nft_template",
      "path": "/usr/local/libexec/api-migrator/gateway/templates/forced-gateway-egress.nft.in",
      "digest": "sha256:1515151515151515151515151515151515151515151515151515151515151515"
    },
    {
      "role": "cleanup",
      "path": "/usr/local/libexec/api-migrator/deployment/cleanup-runner.sh",
      "digest": "sha256:9999999999999999999999999999999999999999999999999999999999999999"
    },
    {
      "role": "production_wrapper",
      "path": "/usr/local/libexec/api-migrator/run-credential-free-preview.sh",
      "digest": "sha256:8888888888888888888888888888888888888888888888888888888888888888"
    },
    {
      "role": "production_observer",
      "path": "/usr/local/libexec/api-migrator/deployment/observe-runner.mjs",
      "digest": "sha256:aaaaaaaaaaaaaaaaaaaaaaaaaaaaaaaaaaaaaaaaaaaaaaaaaaaaaaaaaaaaaaaa"
    },
    {
      "role": "production_runner_systemd_template",
      "path": "/usr/local/libexec/api-migrator/deployment/systemd/api-migrator-runner.service.in",
      "digest": "sha256:1616161616161616161616161616161616161616161616161616161616161616"
    },
    {
      "role": "production_observer_systemd_template",
      "path": "/usr/local/libexec/api-migrator/deployment/systemd/api-migrator-runner-observer.service.in",
      "digest": "sha256:1717171717171717171717171717171717171717171717171717171717171717"
    },
    {
      "role": "lifecycle_drill_systemd_template",
      "path": "/usr/local/libexec/api-migrator/deployment/systemd/api-migrator-lifecycle-drill.service.in",
      "digest": "sha256:1818181818181818181818181818181818181818181818181818181818181818"
    },
    {
      "role": "lifecycle_drill_observer_systemd_template",
      "path": "/usr/local/libexec/api-migrator/deployment/systemd/api-migrator-lifecycle-drill-observer.service.in",
      "digest": "sha256:1919191919191919191919191919191919191919191919191919191919191919"
    }
  ],
  "activationBlocked": true,
  "externalSigningEligible": false,
  "authorizationStatus": "non_authorizing_runtime_manifest_only"
}
